user,text
JG,"Hi MM,     I liked you definitions of culture and eLearning, especially how it is taught or inherited by us from close family members. I relate to this as I am Hispanic and live in Santa Fe, NM where this concept of generativity involving culture is very prominent. I was initially taught by my elders what was culutally acceptable and what was not, however, as I grow and age, I find some of those things that I was taught by my elders to be either true or very false. I see this with my niece and her daughter (I am a 29 year old Great-Uncle:) and how she is already instilling our cultural knowledge within her. I also like the website you found and how eLearning is a transformational change that affects everyone. I believe it is very uncomfortable and shocking for some to realize that you do not need a brick and mortar institution with teachers and students present in the classroom for someone to learn well. This change of thinking requires some transformational learning (OLIT 561:) to make the transition from traditional learning to eLearning successful. Great post, have a great weekend! "
TK,"I define Culture as the combined affect on a person by the people, locations, education, and experiences they have been exposed to in their lifetime. I used to teach middle school and a large component of my work was helping kids define their communities, and their rights and responsibilities in those communities. I feel like I'm living my class in a higher education setting! As for eLearning, I would say that it is any kind of knowledge transfer that occurs via a modern electronic medium including computer, phones, smart phones, tablets.t"
TK,"JL, I love your point that culture is unwritten rules that everyone follows. It makes me think of the different departments I work with and the tricky issue of the lunch hour'. For some, the lunch hour is truly a time when people are gone from their desks, for others it's considered a time to get caught up on your own before heading to more meetings, and still another group considers it totally normal to schedule all kinds of meetings over the lunch hour with no consideration for food at the meeting. I feel like the managers and high-level executives over a department often influence this type of decision, but it's an example of how a little thing, one hour a day, can cause a lot of strife and challenge in a small work environment. I cannot imagine the implications on a large scale of those unspoken norms.'"
KB,"I really enojoyed reading about and thinking though everyone's thoughts on both culture and elearning.  I decided to try to start combining some of these ideas to incorporate the important ideas everyone brought up.  Below is my original definition, and the redefined version (in bold).  Thanks to everyone for helping to extend and push my thinking.  I thin-k, especially with culture, I was really limiting my definition to a broader, big picture definition and forgetting about how culture also exists in small groups. Culture: Original: To me, culture is the conglomeration of all of the people, situations, and environmental factors around a person that work together to create their identity.  This includes geography, language, values, social influences/norms /expectations/customs, race, ethnicity, religion, socioeconomic status, political interactions, sexual orientation, and gender identification. Redefined: Culture is a people-centered set of shared contexts related to beliefs, ideas, traditions, values, knowledge that contribute to a system of practices and interactions that is either shared, built, or imposed on a defined group.  These contexts are often built by family, friends, language, experiences, religion, education, ethnicity, race, public influence, socio-economic status, political interactions, sexual identities, social norms and expectations, geography, and values, and helps to create individual personal identities. E-learning: original: To me, elearning is any time a person learns something or teaches something via electronic media of any variety.  This could be directed by self or others and could be formal or informal.  It could include components of traditional classroom learning, or could be completely atypical of classroom learning. Redefined: Elearning is learning or teaching facilitated by electronic media of any variety, or device and is typically dependant on transactions via Internet.  This could be directed by self or others and could be formal or informal.  It could include components of traditional classroom learning, or could be completely atypical of classroom learning (use of a learning management system)."
JL,"Hi KB, Your synthesis here is awesome - I also learned so much from the discussions and am definitely in a different state of mind regarding culture.  You reminded me of something - I forget that sometimes aspects of our particular culture(s) can be imposed on us, and can extend on multiple levels; for instance, as a child, I was taught that being respectful meant not questioning opinions of our elders, however, not thinking outside of the box prevented me from wanting to learn different perspectives - until much later (high school and college).  Now, at family gatherings where there are still those few elders in attendance, it can be a challenge to 'switch gears' when talking to the different sets of family members (now subcultures), but in order to avoid insulting or even alienating others, it becomes almost necessary to do just that. "
JL,"Hi JG, yes, I agree, what some may have decided is a 'non-issue' can mean all the difference in someone's day.  To KB's point, when aspects of a culture are imposed on us, we tend to follow suit to avoid conflict.  I wonder what would happen if folks declined meetings (electronic appointments on email), or did not show for the lunch meetings with the reason being 'sorry, that is during my lunch hour.'  Would there be a chance to find a more opportune time (group decision) or would it seem that these folks do not care about the overall well-being of the company?  You are right, it depends on which culture you choose to be a part of, which unfortunately can divide people in departments, prevent collaboration and productivity, and cause unspoken grief for many folks."
JL,"Hi JG, ok, I see what you are saying about incentives, thanks for the clarification.  I remember when I first began the OLIT program, I enrolled in an online class and felt so overwhelmed; I was so thankful for the support of my fellow classmates, the instructor and the technical support that was brought to my attention immediately, as well as the discussions of 'why online classes are beneficial.'  I was drawn to the incentives of mobile accessibility and learning at my own pace.  Thanks again!"
LM,"I have read through the threads in this section, and I am very impressed with the level of thoughtfulness and the extent of teaching experience embedded in this group. I feel fortunate to be part of this class. I do not come from a similar background as most of you. BS is perhaps the closest classmate with whom I can identify a cultural similarity. I have never been an 'official' teacher other than a lab instructor for freshmen physics students. In an unofficial capacity, I have taught employees and military personnel in my charge specific skills that would allow them to advance in their careers. What follows is my definitions: Culture: To be able to define this term, it is necessary to determine its context. For a biologist, it is something to be found in a Petri dish. For a health food enthusiast, it's yogurt; and for a Brooklynite, pronouncing the word with the empathesis on the second syllable, it's what Upper West Side Manhattanites use for amusement. I suspect that for our purposes, we had better not stray too far from a socio-political or even an anthropological context. I believe it to be an all-encompassing term for what takes place whenever two or more people interact. We are not to limit ourselves to the physical aspects of this interaction, but must examine the psychological, emotional and spiritual components of such interactions if we are to grasp the true meaning of the concept. I suppose that under these conditions or criteria, culture could be nothing short of human life itself. Indeed, what would human life be if not for its interpersonal interactions. For how do we build anything - whether that be families, nations or bridges - without human interaction? So culture is that quality of human existence that is defined by the interaction of its participants. eLearning: This is a loaded term. At first glance, this simple and innocent-looking combination of two words, more accurately a letter and a word, seems a necessary consequence of our modern world. On the surface, the word carries the meaning of combining leaning and electronic. But it is safe to say that in today's world, the meaning of electronic has subtly shifted to digital in this context. With this shift, the meaning has incorporated the concept of a computer and the use of it as a tool to gain access to the virtual world of information. Now we enter a speculative area whereby we can envision a brave new world where learning is enhanced by these electronic access tools. This is no longer a simple combining of meanings, but a paradigm shift in perspective. This is accomplished by the unavoidable comparison between the human brain and computers, and an even more profound comparison between the human nervous system and the WWW/Internet. What are we to do? This new world is ours to explore with all its euphoric epiphanies and hidden dangers. May we have the wisdom to know the difference? LM, Aug 26, 2012 Back to the discussion thread: I was taken by EP's comment about how learning a new language is synonymous with learning a new culture. Culture here refers to a population of people that share the same language. This points to the close connection between language and the culture in which that language is used. If we examine the linguistic structure of such a language, do we gain insight into how to deal with or design learning systems for different ethic or cultural groups? An example of this would be the direct translation of the term in the Russian language for speed-bump: policeman lying down. The results of the meaning for speed bump is the same in either language, but the cultural background that provides the image is quite different. There was a lot of discussion about the Asian cultures having a negative perception of individualism. I have always found the Japanese expression 'the nail that sticks out gets hammered down' a wonderful window into the heart of the Japanese, and by extension, Asia societies. This feeling might have something to do with the hierarchical structure of Asian societies that existed until recent history. Malcolm Gladwell describes in his book 'Outliers' how this hierarchical structure can have dire consequences when employed in a modern technological setting such as an airplane cockpit. There is much more to comment upon in the threads, but enough said for the time being. "
KB,"JL, I really didn't even put that piece together until I started thinking about what others were saying were the contributing factors.  From that I realized that we don't have the control we sometimes connect with culture.  We actually are probably subject to our cultural factors more than we choose?  Right?  At least that's where my thoughts started going."
KB,"LM, I really identify with your ideas about how culture impacts how we can translate information.  I remember in my time teaching, that I was always pushed to think about how my identity, things familiar to me used as examples might not be the same for my students.  What becomes really tricky is thinking about the diversity that we now encounter in group settings.  Measuring the difference in culture and addressing it equally across all groups is a real challenge in teaching. Thanks for your thoughts!"
CJ,"Hi JG, Thanks for your response.  As I read the readings assigned for this week, and also including the Iron & Silk videos, my definition is also being restructured too.  It makes me question if the definition of culture itself is fluid since new types of cultures can/are being developed from different contexts all the time?  What I've gathered so far that culture in relation to a specific context such as 'eLearning' is a very compLM thing! Hope you have had a relaxing Labor Day weekend! "
CJ,"Hi KB/JL Enjoyed reading your conversation here and where your thoughts lead you.  Your question about how we are probably subject to our cultural factors more than we choose is an insightful one.  I personally think this is true for myself.  I have noticed that around certain groups of people, certain TV shows I watch, certain family members, certain areas of the country I've lived in, certain books I've read, etc. I am shaped by them, but not noticeably.  And I can imagine that there are many other cultural influences that have in fact influenced me that I cannot account for whatsoever because I am constantly surrounded by them, and they are happening 'in the background' so to speak. "
CJ,"Hi LM, Enjoyed reading your post as well.  I took not of your comment about EP's comment on language: 'Culture here refers to a population of people that share the same language.'  I read this in a way that made me think about how language isn't limited to English, German, French, Cantonese, Japanese, etc.  Cultures develop their own 'languages' on top of the actual language people speak. "
AN,"After reading the posts and thinking about my own definition of Culture and eLearning, I decided to approach it from my own point of view.  Because of my husband being retired military I have lived not only in Europe, but all over the United States.  Because I am not European I decided to define Culture as an American.  Defining culture from an American point of view is tricky.  Ultimately we are all from somewhere else and do not have the kinds of cultural roots that people from other countries have.  Culture changes depending on where in the US you live.  New Mexico culture is vastly different than the Midwestern culture I grew up in.  Different foods, beliefs, attitudes, and even language.  I tried to look at it from a larger perspective as to what binds us Americans together.  I believe that the Constitution is first and foremost what sets us apart from the rest of the world and what binds us together regardless of where we live. We grow up being taught the Constitution and believing in the rights and privileges that it affords us.  I liked the idea of subcultures.  I think the region where you grew up or live presently is a subculture within the US, and I also think that your family would be a sub subculture. As far as eLearning is concerned, I like KB's definiton that learning and teaching is facilitated by technology.  I also felt that JG's three pillars were a very succint want of describing the eLearning process.  Initially I had a definition in my head of eLearning, but I saw some internet research that my daughter had printed out for her AP Biology class.  It got my thinking eLearning can occur even in a traditional classroom setting. Then if eLearning doesn't HAVE to occur in a setting where the students are separated from the teacher and getting their instruction solely online, then what is it?  It sort of made my head spin to think of all the ways eLearning can be defined and why it is so difficult.  I think that is why I like KB's and JG's defnitions the best."
BS,"LM, CJ, KB That thing about culture being reflected in language really struck me. Having spent a fair amount of time in the recent past working with my daughter to translate a police report from Dutch to English for an insurance claim - knowing no Dutch myself and my daughter only knowing a little conversational Dutch - that is most certainly the case. In case you haven't tried it, Google translate mangles Dutch (both directions) and part of the reason is that the entire attitude toward the world is different. We tell our kids to 'Do your best! Be good!' and Dutch parents tell their children 'Be normal!'The idioms are so completely foreign as to render some meanings completely incomprehensible. The opportunity for misinterpretations in email can be enormous. For instance, I innocently forwarded an invitation to a risk manager's organization to my former Director - the description of the organization seemed as if it were at a higher management level than I occupied, and I thought she might like to make contact with the important people reported to be members of the group. I made a self-deprecating joke about it being 'too rich for my blood.' She was so offended that she gave me a verbal reprimand in front of my immediate supervisor for passing along the email. I had no idea I had said anything wrong! Those of you that teach ESL or speak multiple languages - I can't even imagine how you manage the cultural divides.  My hat is off to you. ('my cap is gone to you.')"
BS,"TK - On the lunch hour thing, and similar workplace norming... in my opinion, it is incumbent on the manager to make those 'unspoken norms' spoken.  In addition, if the manager does not himself generally conform to the expected behavior, the standard for the department will undoubtedly slip to a norm closer to the manager's demonstrated behavior rather than the stated expected behavior. For instance, a manager that tells the staff that lunch hours are no more than 60 minutes, but takes two-hour lunches himself, should not be surprised that the 60 minute standard is not obersved. This discussion does make me think of something else. You guys, my classmates, have revealed some things about your cultures on the boards. Some were brought up never to question elders, some were brought up to question everything, some could question teachers but not parents, and so forth. I have already noted elsewhere that I got into terrible trouble for a well-meant email. Here's the rub: In the workplace, we naturally should be respectful of other people's cultures... but we don't have any idea what they are. It's like saying 'Some of my best friends are ....<fill in blank with stereotype.>' When my oldest son was 16, he had hair down to his waist. He was an indifferent student, but a gifted programmer. So in a last ditch effort to keep him engaged in learning, I took him to a local consulting firm to apply for a programming internship. I told him I thought he shoud cut his hair for the interview; he said that if they offered him a job and wanted him to cut it he'd consider it. Dropped him off - they gave all of the several dozen applicants tests - called him back for an interview and offered him a job the next week. I asked about his hair... he said it was no problem to them at all. Turns out the company was owned by a Sikh family, and they didn't think a thing about his hair (other than to ask him to put it up under his hat for site work at their client sites.) Kid 1. Mom 0. He's still a programmer, but for a university now. And he did cut his hair. It's in a mohawk now. On dress occasions, he dyes it blue."
DK,"I've read alot of your insightful ideas of culture and its affect on e-learning.  Culture, to me, is the values, beliefs, traditions and accepted behaviors that we accumulate throughout our lives - most heavily when we're young but as EP suggested, cultural change is absorbed at various rates and it may well be represented as a bell curve.  I like that idea.  To me, it's the lense in which we view the world - our perceptions, how we behave, what offends us, what makes us happy.  I was particularly stuck by the 'Iron & Silk' video where they were talking about their happiest moments and how different the idea of 'happiness' was in one culture vs. another. My definition of e-learning includes having to use some sort of technology to maintain connection with the teacher and fellowclassmates; ability to move forward & backward within a class to deepen and tailor individual's learning; immediate evaluation of what's being learned and the flexibility for the teacher and designers to alter the class/system; consistent, previously designed structure and stated expectations and goals; use of group and individual learning modes; need for some computer literacy and availability.  I'm new to the concept of e-learning but from what I've gathered so far, it's much more oriented towards flexibility of the learner in terms of learning style, life style and even intelligence and prior knowledge. We all get the same content but we might get differing depths of knowledge. In terms of how culture affects e-learning, it helps that we understand some of the cultural differences when developing and teaching courses.  For example, Lani & Sanchez (1998) mentioned how teaching adult Hispanic classes required a collaborative, action/activity-oriented approach that used real-world examples. Even such basic considerations like time, silence, motivation, authority need to be considered in developing elearning modules across cultures.  That being said, it really comes down to individuals and constant communication and feedback about what works and what doesn't.  I was born in Queens and raised on Long Island.  I hope that no one will ever label me a 'stereotypical New Yorker', although I do have some residual tendencies.  My phobias are crowds, lines, traffic and finding parking spaces....go figure. :) "
LW,"Hi TK that is interesting that you define culture in terms of the individual. I never looked at it from that perspective. I've always had a picture of a bunch of people standing on a map, on the country they live in, working as a group to create culture rather than one person who is affected by all that happens around him, thus creating culture. I think this is an important distinction and it broadens my concept of culture. "
EP,"Hi BS, You bring up a great example about language and translation! In many languages the meaning can not be directly translated into English and vice versa. It requires some understanding of how a native-speaker views the world, their social/cultural norms and perspectives, as you've said about the Dutch 'their entire attitude toward the world is different.' Also, you bring up a great point about the enormous potential for misunderstandings when communicating even among people whom we argueable share a common 'culture.' Even the art of 'selfdepreciation' can be misconstrued. My japanese teacher in college gave us a great example of crosscultural misunderstandings when communicating. In japan, they have the concept of  in-group and out-group. People in your 'in-group' are people like your family, friends and even company. People in your 'out-group' are everyone else you don't intimately associate with. So in the Japanese culture it is impolite to accept a compliment about someone or something in your 'in-group.' For example if I said, 'oh your daughter is so smart~!' You must respond with, 'oh no, no no she isn't.' This response is mandatory and expected! It doesn't mean you actually believe your daughter is dumb, but it is the culturally accepted response. But in the case of my Japanese teacher, who married a western man, when the two families met, her mother (japanese) gave the daughter-in-law a compliment, 'oh your daugher is so pretty.' To which the Western mom responded, 'I know.' Suffice to say, shock and appall from the japanese mom! Its amazing that something as simple as a compliment can have so much cultural undertone."
EP,"Hi KB, I agree with the direction your thoughts are taking you. :) I think in general we are not aware of the affect of our cultural programming. At the core, its something that is deeply imbedded in the way we, think, act, communicate and percieve the world. I think in general we begin to become aware of the nature of cultural programming when 1) we reflect upon our possible cultural programming and how it affects us (like in this class) and/or 2) when actually collide with a differing cultural perspective."
EP,"Hey LM, I always enjoy reading your posts! Your thoughts are so well-articulated. :) Its great that you bring up the question: 'If we examine the linguistic structure of such a language, do we gain insight into how to deal with or design learning systems for different ethic or cultural groups?' I know that from experience, cultural values and norms are sometimes built into the Asian language. For example, in the Japanese culture you mentioned the idea of heirarchy. The Japanese language has something called 'keigo' or honorifics. The basics of it are that based upon the social level of the person you are speaking to (higher or lower than yourself) you will change the structure of the verb or sentence you are using to adequetly convey and acknowledge the other person's level. Also, in China, for example humility and modesty are highly prized. They have a set phrase, 'na li na li' which doesn't really have meaning on its own (it shares the same characters as 'Where') but in the context of someone giving you a compliment it means, 'oh, its nothing' or 'oh, not really'. I think it is interesting to consider how the language and 'built-in' cultural values could have an impact on how learning systems are designed!"
